{
  "$schema": "https://json-schema.org/draft/2020-12/schema",
  "$id": "pogoda.schema.json",
  "title": "pogoda.json",
  "type": "object",
  "required": ["generated_at", "days", "wx", "cells"],
  "additionalProperties": false,
  "properties": {
    "generated_at": {"type": "string", "format": "date-time"},
    "days": {
      "type": "array",
      "minItems": 8,
      "maxItems": 8,
      "items": {"type": "string", "format": "date"}
    },
    "wx": {
      "type": "object",
      "additionalProperties": {"$ref": "#/$defs/wxcell"}
    },
    "cells": {
      "type": "object",
      "additionalProperties": {"$ref": "#/$defs/cell"}
    }
  },
  "$defs": {
    "series": {
      "type": "array",
      "minItems": 8,
      "maxItems": 8,
      "items": {"type": "number", "minimum": 0, "maximum": 1}
    },
    "series_pulse": {
      "type": "array",
      "minItems": 8,
      "maxItems": 8,
      "items": {"type": "number", "minimum": 1, "maximum": 1.2}
    },
    "lim": {"enum": ["dry", "dry_soil", "cold", "hot", "season", "frost", null]},
    "wxcell": {
      "type": "object",
      "required": ["rain_mm", "soil_t", "soil_m"],
      "additionalProperties": false,
      "properties": {
        "rain_mm": {"type": "array", "minItems": 8, "maxItems": 8, "items": {"type": "number", "minimum": 0}},
        "soil_t": {"type": "array", "minItems": 8, "maxItems": 8, "items": {"type": "number"}},
        "soil_m": {"type": "array", "minItems": 8, "maxItems": 8, "items": {"type": "number", "minimum": 0, "maximum": 1}},
        "et0_mm": {"type": "array", "minItems": 8, "maxItems": 8, "items": {"type": "number", "minimum": 0}},
        "soil_m_deep": {"type": "array", "minItems": 8, "maxItems": 8, "items": {"type": "number", "minimum": 0, "maximum": 1}},
        "t2m_min": {"type": "array", "minItems": 8, "maxItems": 8, "items": {"type": "number"}}
      }
    },
    "species": {
      "type": "object",
      "required": ["w", "rain", "temp", "season", "lim"],
      "additionalProperties": false,
      "properties": {
        "w": {"$ref": "#/$defs/series"},
        "rain": {"$ref": "#/$defs/series"},
        "temp": {"$ref": "#/$defs/series"},
        "season": {"$ref": "#/$defs/series"},
        "pulse": {"$ref": "#/$defs/series_pulse"},
        "frost": {"$ref": "#/$defs/series"},
        "lim": {"type": "array", "minItems": 8, "maxItems": 8, "items": {"$ref": "#/$defs/lim"}}
      }
    },
    "cell": {
      "type": "object",
      "additionalProperties": {"$ref": "#/$defs/species"}
    }
  }
}
