{
 "generated_at": "2026-10-03T05:00:12+02:00",
 "days": [
  "2026-10-02",
  "2026-10-03",
  "2026-10-04",
  "2026-10-05",
  "2026-10-06",
  "2026-10-07",
  "2026-10-08",
  "2026-10-09"
 ],
 "wx": {
  "506_178": {
   "rain_mm": [
    35.0,
    35.0,
    32.0,
    35.0,
    35.0,
    32.0,
    35.0,
    35.0
   ],
   "soil_t": [
    9.1,
    8.9,
    8.8,
    8.7,
    8.5,
    8.3,
    8.2,
    8.1
   ],
   "soil_m": [
    0.226,
    0.224,
    0.222,
    0.22,
    0.218,
    0.216,
    0.214,
    0.212
   ]
  },
  "507_178": {
   "rain_mm": [
    0.0,
    2.5,
    5.0,
    7.5,
    10.0,
    12.5,
    15.0,
    17.5
   ],
   "soil_t": [
    12.0,
    12.0,
    12.0,
    12.0,
    12.0,
    12.0,
    12.0,
    12.0
   ],
   "soil_m": [
    0.12,
    0.12,
    0.12,
    0.12,
    0.12,
    0.12,
    0.12,
    0.12
   ]
  }
 },
 "cells": {
  "506_178": {
   "borowik": {
    "w": [
     0.276,
     0.238,
     0.226,
     0.236,
     0.201,
     0.189,
     0.196,
     0.165
    ],
    "rain": [
     0.533,
     0.483,
     0.483,
     0.533,
     0.483,
     0.483,
     0.533,
     0.483
    ],
    "temp": [
     0.517,
     0.492,
     0.467,
     0.442,
     0.417,
     0.392,
     0.367,
     0.342
    ],
    "season": [
     1.0,
     1.0,
     1.0,
     1.0,
     1.0,
     1.0,
     1.0,
     1.0
    ],
    "lim": [
     "cold",
     "dry",
     "cold",
     "cold",
     "cold",
     "cold",
     "cold",
     "cold"
    ]
   },
   "podgrzybek": {
    "w": [
     0.453,
     0.399,
     0.387,
     0.413,
     0.362,
     0.35,
     0.373,
     0.326
    ],
    "rain": [
     0.533,
     0.483,
     0.483,
     0.533,
     0.483,
     0.483,
     0.533,
     0.483
    ],
    "temp": [
     0.85,
     0.825,
     0.8,
     0.775,
     0.75,
     0.725,
     0.7,
     0.675
    ],
    "season": [
     1.0,
     1.0,
     1.0,
     1.0,
     1.0,
     1.0,
     1.0,
     1.0
    ],
    "lim": [
     "dry",
     "dry",
     "dry",
     "dry",
     "dry",
     "dry",
     "dry",
     "dry"
    ]
   },
   "kurka": {
    "w": [
     0.15,
     0.119,
     0.1,
     0.089,
     0.062,
     0.044,
     0.027,
     0.006
    ],
    "rain": [
     0.818,
     0.75,
     0.75,
     0.818,
     0.75,
     0.75,
     0.818,
     0.75
    ],
    "temp": [
     0.183,
     0.158,
     0.133,
     0.108,
     0.083,
     0.058,
     0.033,
     0.008
    ],
    "season": [
     1.0,
     1.0,
     1.0,
     1.0,
     1.0,
     1.0,
     1.0,
     1.0
    ],
    "lim": [
     "cold",
     "cold",
     "cold",
     "cold",
     "cold",
     "cold",
     "cold",
     "cold"
    ]
   },
   "kozlarz": {
    "w": [
     0.276,
     0.238,
     0.226,
     0.236,
     0.201,
     0.189,
     0.196,
     0.165
    ],
    "rain": [
     0.533,
     0.483,
     0.483,
     0.533,
     0.483,
     0.483,
     0.533,
     0.483
    ],
    "temp": [
     0.517,
     0.492,
     0.467,
     0.442,
     0.417,
     0.392,
     0.367,
     0.342
    ],
    "season": [
     1.0,
     1.0,
     1.0,
     1.0,
     1.0,
     1.0,
     1.0,
     1.0
    ],
    "lim": [
     "cold",
     "dry",
     "cold",
     "cold",
     "cold",
     "cold",
     "cold",
     "cold"
    ]
   },
   "maslak": {
    "w": [
     0.453,
     0.399,
     0.387,
     0.413,
     0.362,
     0.35,
     0.373,
     0.326
    ],
    "rain": [
     0.533,
     0.483,
     0.483,
     0.533,
     0.483,
     0.483,
     0.533,
     0.483
    ],
    "temp": [
     0.85,
     0.825,
     0.8,
     0.775,
     0.75,
     0.725,
     0.7,
     0.675
    ],
    "season": [
     1.0,
     1.0,
     1.0,
     1.0,
     1.0,
     1.0,
     1.0,
     1.0
    ],
    "lim": [
     "dry",
     "dry",
     "dry",
     "dry",
     "dry",
     "dry",
     "dry",
     "dry"
    ]
   },
   "rydz": {
    "w": [
     0.437,
     0.382,
     0.367,
     0.389,
     0.338,
     0.324,
     0.341,
     0.295
    ],
    "rain": [
     0.533,
     0.483,
     0.483,
     0.533,
     0.483,
     0.483,
     0.533,
     0.483
    ],
    "temp": [
     0.82,
     0.79,
     0.76,
     0.73,
     0.7,
     0.67,
     0.64,
     0.61
    ],
    "season": [
     1.0,
     1.0,
     1.0,
     1.0,
     1.0,
     1.0,
     1.0,
     1.0
    ],
    "lim": [
     "dry",
     "dry",
     "dry",
     "dry",
     "dry",
     "dry",
     "dry",
     "dry"
    ]
   }
  },
  "507_178": {
   "borowik": {
    "w": [
     0.0,
     0.0,
     0.0,
     0.0,
     0.0,
     0.0,
     0.042,
     0.083
    ],
    "rain": [
     0.0,
     0.0,
     0.0,
     0.0,
     0.0,
     0.0,
     0.042,
     0.083
    ],
    "temp": [
     1.0,
     1.0,
     1.0,
     1.0,
     1.0,
     1.0,
     1.0,
     1.0
    ],
    "season": [
     1.0,
     1.0,
     1.0,
     1.0,
     1.0,
     1.0,
     1.0,
     1.0
    ],
    "lim": [
     "dry_soil",
     "dry_soil",
     "dry_soil",
     "dry_soil",
     "dry_soil",
     "dry_soil",
     "dry_soil",
     "dry_soil"
    ]
   },
   "podgrzybek": {
    "w": [
     0.0,
     0.0,
     0.0,
     0.0,
     0.0,
     0.0,
     0.042,
     0.083
    ],
    "rain": [
     0.0,
     0.0,
     0.0,
     0.0,
     0.0,
     0.0,
     0.042,
     0.083
    ],
    "temp": [
     1.0,
     1.0,
     1.0,
     1.0,
     1.0,
     1.0,
     1.0,
     1.0
    ],
    "season": [
     1.0,
     1.0,
     1.0,
     1.0,
     1.0,
     1.0,
     1.0,
     1.0
    ],
    "lim": [
     "dry_soil",
     "dry_soil",
     "dry_soil",
     "dry_soil",
     "dry_soil",
     "dry_soil",
     "dry_soil",
     "dry_soil"
    ]
   },
   "kurka": {
    "w": [
     0.0,
     0.0,
     0.0,
     0.0,
     0.0,
     0.03,
     0.068,
     0.106
    ],
    "rain": [
     0.0,
     0.0,
     0.0,
     0.0,
     0.0,
     0.045,
     0.102,
     0.159
    ],
    "temp": [
     0.667,
     0.667,
     0.667,
     0.667,
     0.667,
     0.667,
     0.667,
     0.667
    ],
    "season": [
     1.0,
     1.0,
     1.0,
     1.0,
     1.0,
     1.0,
     1.0,
     1.0
    ],
    "lim": [
     "dry_soil",
     "dry_soil",
     "dry_soil",
     "dry_soil",
     "dry_soil",
     "dry_soil",
     "dry_soil",
     "dry_soil"
    ]
   },
   "kozlarz": {
    "w": [
     0.0,
     0.0,
     0.0,
     0.0,
     0.0,
     0.0,
     0.042,
     0.083
    ],
    "rain": [
     0.0,
     0.0,
     0.0,
     0.0,
     0.0,
     0.0,
     0.042,
     0.083
    ],
    "temp": [
     1.0,
     1.0,
     1.0,
     1.0,
     1.0,
     1.0,
     1.0,
     1.0
    ],
    "season": [
     1.0,
     1.0,
     1.0,
     1.0,
     1.0,
     1.0,
     1.0,
     1.0
    ],
    "lim": [
     "dry_soil",
     "dry_soil",
     "dry_soil",
     "dry_soil",
     "dry_soil",
     "dry_soil",
     "dry_soil",
     "dry_soil"
    ]
   },
   "maslak": {
    "w": [
     0.0,
     0.0,
     0.0,
     0.0,
     0.0,
     0.0,
     0.042,
     0.083
    ],
    "rain": [
     0.0,
     0.0,
     0.0,
     0.0,
     0.0,
     0.0,
     0.042,
     0.083
    ],
    "temp": [
     1.0,
     1.0,
     1.0,
     1.0,
     1.0,
     1.0,
     1.0,
     1.0
    ],
    "season": [
     1.0,
     1.0,
     1.0,
     1.0,
     1.0,
     1.0,
     1.0,
     1.0
    ],
    "lim": [
     "dry_soil",
     "dry_soil",
     "dry_soil",
     "dry_soil",
     "dry_soil",
     "dry_soil",
     "dry_soil",
     "dry_soil"
    ]
   },
   "rydz": {
    "w": [
     0.0,
     0.0,
     0.0,
     0.0,
     0.0,
     0.0,
     0.042,
     0.083
    ],
    "rain": [
     0.0,
     0.0,
     0.0,
     0.0,
     0.0,
     0.0,
     0.042,
     0.083
    ],
    "temp": [
     1.0,
     1.0,
     1.0,
     1.0,
     1.0,
     1.0,
     1.0,
     1.0
    ],
    "season": [
     1.0,
     1.0,
     1.0,
     1.0,
     1.0,
     1.0,
     1.0,
     1.0
    ],
    "lim": [
     "dry_soil",
     "dry_soil",
     "dry_soil",
     "dry_soil",
     "dry_soil",
     "dry_soil",
     "dry_soil",
     "dry_soil"
    ]
   }
  }
 }
}